{
  "id": "edit_existing-v1",
  "type": "workflow_scene",
  "family": "editing-existing",
  "instruction": "Edit the existing solid named housing to world bounds (100,-40,15) to (160,-10,35) mm by scaling and moving it. Keep its object ID, name and Parts layer. The reference solid on Datum must remain completely unchanged, including its ID and attributes. Leave exactly these two objects and no new layers. Match bounds within 0.001 mm and volume within 1%; objects must be visible and unlocked.",
  "units": "Millimeters",
  "linear_tolerance": 0.001,
  "relative_volume_tolerance": 0.01,
  "initial": [
    {
      "name": "housing",
      "layer": "Parts",
      "min": [
        0,
        0,
        0
      ],
      "max": [
        40,
        20,
        10
      ]
    },
    {
      "name": "reference",
      "layer": "Datum",
      "min": [
        200,
        0,
        0
      ],
      "max": [
        210,
        12,
        8
      ]
    }
  ],
  "targets": [
    {
      "name": "housing",
      "layer": "Parts",
      "min": [
        100,
        -40,
        15
      ],
      "max": [
        160,
        -10,
        35
      ],
      "preserve_from": "housing"
    },
    {
      "name": "reference",
      "layer": "Datum",
      "min": [
        200,
        0,
        0
      ],
      "max": [
        210,
        12,
        8
      ],
      "preserve_from": "reference",
      "unchanged": true
    }
  ],
  "layers": [
    "Parts",
    "Datum"
  ],
  "inspection_names": []
}
