{
  "id": "recover_intermediate-v1",
  "type": "workflow_scene",
  "family": "recovery",
  "instruction": "The prepared wrong_intermediate box is a known wrong result. Delete that object and replace it with one valid closed box named corrected on Parts, with world bounds (0,0,0) to (50,25,15) mm. The old wrong_intermediate object must be absent. Keep reference on Datum completely unchanged, including ID and attributes. Leave only corrected and reference, with no new layers. Match bounds within 0.001 mm and volume within 1%; objects must be visible and unlocked.",
  "units": "Millimeters",
  "linear_tolerance": 0.001,
  "relative_volume_tolerance": 0.01,
  "initial": [
    {
      "name": "wrong_intermediate",
      "layer": "Parts",
      "min": [
        0,
        0,
        0
      ],
      "max": [
        30,
        20,
        10
      ]
    },
    {
      "name": "reference",
      "layer": "Datum",
      "min": [
        200,
        0,
        0
      ],
      "max": [
        210,
        12,
        8
      ]
    }
  ],
  "targets": [
    {
      "name": "corrected",
      "layer": "Parts",
      "min": [
        0,
        0,
        0
      ],
      "max": [
        50,
        25,
        15
      ]
    },
    {
      "name": "reference",
      "layer": "Datum",
      "min": [
        200,
        0,
        0
      ],
      "max": [
        210,
        12,
        8
      ],
      "preserve_from": "reference",
      "unchanged": true
    }
  ],
  "layers": [
    "Parts",
    "Datum"
  ],
  "inspection_names": []
}
